{
  "_version": "1.0.0",
  "orchestratorName": "ORC-09: Code Review & Refactor Advisor",
  "orchestratorDescription": "Advanced code analysis pipeline using Thinking models for deep audit, followed by architectural refactoring and QA validation.",
  "steps": [
    {
      "id": "step_A",
      "name": "A",
      "label": "Deep Static Auditor",
      "stage_key": "auditor",
      "task_type": "security_audit",
      "cardinality": "1:1",
      "dependsOn": [],
      "ai_settings": {
        "model_id": "gemini-2.0-flash-thinking-exp",
        "generationConfig": {
          "temperature": 0.3,
          "maxOutputTokens": 16000
        }
      }
    },
    {
      "id": "step_B",
      "name": "B",
      "label": "Refactor Architect",
      "stage_key": "architect",
      "task_type": "code_refactor",
      "cardinality": "1:1",
      "dependsOn": ["step_A"],
      "ai_settings": {
        "model_id": "gemini-1.5-pro-latest",
        "generationConfig": {
          "temperature": 0.7,
          "maxOutputTokens": 8192
        }
      }
    },
    {
      "id": "step_C",
      "name": "C",
      "label": "Quality Validator",
      "stage_key": "validator",
      "task_type": "qa_validation",
      "cardinality": "1:1",
      "dependsOn": ["step_B"],
      "ai_settings": {
        "model_id": "gemini-1.5-flash-latest",
        "generationConfig": {
          "temperature": 0.2,
          "maxOutputTokens": 4096
        }
      }
    }
  ]
}
